question,votes,tags
Print all day-dates between two dates [duplicate],209,python datetime
How can I list the contents of a directory in Python?,209,python path
Python csv string to array,209,python string arrays csv
How to construct a set out of list items in python?,209,python list set
PyLint message: logging-format-interpolation,209,python python-3.x pylint
How to output a comma delimited list in jinja python template?,208,python jinja2
Python3 project remove __pycache__ folders and .pyc files,208,python python-3.x python-3.4 delete-file
How to filter rows containing a string pattern from a Pandas dataframe [duplicate],208,python pandas dataframe
How do I check if there are duplicates in a flat list?,208,python string list duplicates
ImportError: No module named 'django.core.urlresolvers',208,python python-3.x django python-3.5 django-2.0
Python app does not print anything when running detached in docker,208,python docker dockerfile
Calculating Pearson correlation and significance in Python,208,python numpy statistics scipy
Take multiple lists into dataframe,208,python numpy pandas
Remove the first character of a string,208,python string
Installing SciPy with pip,208,python installation scipy pip
Find first element in a sequence that matches a predicate,208,python predicate
How to use pip with Python 3.x alongside Python 2.x,208,python python-3.x python-2.7 pip
Why can't Python's raw string literals end with a single backslash?,208,python string literals rawstring
Create a list with initial capacity in Python,208,python list dictionary initialization
Object of custom type as dictionary key,208,python dictionary
Django: “projects” vs “apps”,208,python django namespaces project-organization
How do I get the path of the current executed file in Python?,208,python path directory
“OSError: [Errno 1] Operation not permitted” when installing Scrapy in OSX 10.11 (El Capitan) (System Integrity Protection),207,python macos python-2.7 scrapy
How to use “/” (directory separator) in both Linux and Windows in Python?,207,python linux windows unix
How to output loop.counter in python jinja template?,207,python jinja2
Iterate a list with indexes in Python,207,python list
How to remove convexity defects in a Sudoku square?,207,python opencv computer-vision sudoku
Python pip install fails: invalid command egg_info,207,python pip
How do I format a date in Jinja2?,207,python jinja2
Pythonic way to check if a file exists? [duplicate],207,python file
How to obtain a Thread id in Python?,207,python multithreading python-multithreading python-logging
Is it possible to use argsort in descending order?,207,python numpy
How to keep a Python script output window open?,207,python windows
Using property() on classmethods,207,python oop
Use cases for the 'setdefault' dict method,207,python dictionary setdefault
Is it possible to implement a Python for range loop without an iterator variable?,207,python loops for-loop range
Print all properties of a Python Class [duplicate],206,python oop
How to display pandas DataFrame of floats using a format string for columns?,206,python python-2.7 pandas ipython dataframe
How do I get IntelliJ to recognize common Python modules?,206,python intellij-idea
"django MultiValueDictKeyError error, how do I deal with it",206,python django exception
Fastest way to convert an iterator to a list,206,python iterator list-comprehension
How can I check whether a numpy array is empty or not?,206,python numpy
Getting the docstring from a function,206,python
How to get exit code when using Python subprocess communicate method?,206,python subprocess
How to count the number of true elements in a NumPy bool array,206,python arrays numpy count boolean
When and why should I use a namedtuple instead of a dictionary? [duplicate],206,python
“pip install --editable ./” vs “python setup.py develop”,206,python pip setuptools python-packaging
Why does Pycharm's inspector complain about “d = {}”?,206,python pycharm
How do I write good/correct package __init__.py files,206,python packages
Could not find a version that satisfies the requirement <package>,206,python pip requirements.txt
Using a dictionary to count the items in a list [duplicate],205,python
How to add header row to a pandas DataFrame,205,python csv pandas header
TypeError: got multiple values for argument,205,python python-3.x
How to strip all whitespace from string,205,python python-3.x spaces strip
How to calculate the time interval between two time strings,205,python time python-2.6
How can I return two values from a function in Python?,205,python list function return return-value
Generate a heatmap in MatPlotLib using a scatter data set,205,python matplotlib heatmap histogram2d
How to use Python to execute a cURL command?,205,python curl
Formatting floats without trailing zeros,205,python formatting floating-point pretty-print
How to modify list entries during for loop?,205,python
How do I upgrade to Python 3.6 with conda?,205,python macos anaconda conda
"Why can a function modify some arguments as perceived by the caller, but not others?",205,python
How to get the last N rows of a pandas DataFrame?,204,python pandas dataframe
"Python Flask, how to set content type",204,python flask
How can I get dictionary key as variable directly in Python (not by searching from value)?,204,python dictionary key
Split / Explode a column of dictionaries into separate columns with pandas,204,python json pandas dictionary json-normalize
Build the full path filename in Python,204,python join filenames
Can't compare naive and aware datetime.now() <= challenge.datetime_end,204,python django datetime comparison
How to do a less than or equal to filter in Django queryset?,204,python django django-queryset
How to do a scatter plot with empty circles in Python?,204,python matplotlib geometry scatter-plot scatter
How do I get python's pprint to return a string instead of printing?,204,python pretty-print pprint
Pandas create empty DataFrame with only column names,204,python pandas dataframe
Why do you need explicitly have the “self” argument in a Python method?,204,python oop methods self
Scoping in Python 'for' loops,204,python scope
Downloading a picture via urllib and python,203,python urllib2 urllib
django test app error - Got an error creating the test database: permission denied to create database,203,python sql django postgresql django-testing
Seeing escape characters when pressing the arrow keys in python shell,203,python shell ssh arrow-keys
Parsing HTML using Python,203,python xml-parsing html-parsing
Queue.Queue vs. collections.deque,203,python thread-safety queue
How do I draw a grid onto a plot in Python?,203,python matplotlib
"Pandas column of lists, create a row for each list element",203,python pandas list
How to check a string for specific characters?,203,python string
warning about too many open figures,203,python python-3.x matplotlib
"What are Flask Blueprints, exactly?",203,python flask wsgi
How can I specify working directory for popen,203,python subprocess popen
Getting distance between two points based on latitude/longitude,202,python geocoding geo geography
How can I break up this long line in Python?,202,python formatting code-formatting
How do I get the “id” after INSERT into MySQL database with Python?,202,python mysql database
Update value of a nested dictionary of varying depth,202,python
Case insensitive replace,202,python string case-insensitive
import module from string variable,202,python matplotlib
Pandas DataFrame Groupby two columns and get counts,202,python pandas dataframe
"Which is better in python, del or delattr?",202,python del
sqlalchemy unique across multiple columns,202,python sqlalchemy
Python 'If not' syntax [duplicate],202,python python-2.7
Select rows in pandas MultiIndex DataFrame,202,python pandas dataframe slice multi-index
Python - Check If Word Is In A String,201,python string
How to ignore deprecation warnings in Python,201,python warnings deprecated ignore
"Flatten nested dictionaries, compressing keys",201,python dictionary
get list of pandas dataframe columns based on data type,201,python pandas
How can I print variable and string on same line in Python?,201,python string variables printing
How can I extract all values from a dictionary in Python?,201,python dictionary extract
Pandas split column of lists into multiple columns,201,python pandas list split
Logging uncaught exceptions in Python,201,python logging exception-handling
How do I get current URL in Selenium Webdriver 2 Python?,201,python selenium selenium-webdriver
"“UserWarning: Matplotlib is currently using agg, which is a non-GUI backend, so cannot show the figure.” when plotting figure with pyplot on Pycharm",201,python matplotlib pycharm
How to make an immutable object in Python?,201,python python-3.x immutability
Is there a zip-like function that pads to longest length?,201,python list zip
How can I improve my paw detection?,201,python image-processing
How to retrieve inserted id after inserting row in SQLite using Python?,201,python sqlite
pass **kwargs argument to another function with **kwargs,201,python
"Why does “return list.sort()” return None, not the list?",200,python list sorting return
Execute code when Django starts ONCE only?,200,python django
What do ellipsis […] mean in a list?,200,python python-2.7 python-3.x list ellipsis
Writing a Python list of lists to a csv file,200,python file csv file-io python-2.7
What is the proper way to comment functions in Python?,200,python
How to run multiple Python versions on Windows,200,python windows python-3.x compatibility python-2.x
Using headers with the Python requests library's get method,200,python http-request python-requests
How do I convert this list of dictionaries to a csv file?,200,python csv dictionary data-conversion
pandas get column average/mean,200,python pandas
How do you get the magnitude of a vector in Numpy?,200,python numpy
How to create a temporary directory and get its path/ file name?,200,python temporary-files temporary-directory
How to access object attribute given string corresponding to name of that attribute,200,python object attributes
Lists in ConfigParser,199,python configparser
How to access a dictionary element in a Django template?,199,python django django-templates
Sorting a Python list by two fields,199,python sorting
Python logging: use milliseconds in time format,199,python logging time
u'\ufeff' in Python string,199,python unicode utf-8
Define css class in django Forms,199,python django django-forms
Unpacking a list / tuple of pairs into two lists / tuples [duplicate],199,python list tuples
pandas resample documentation,199,python documentation pandas
How do I catch a numpy warning like it's an exception (not just for testing)?,199,python exception numpy warnings divide-by-zero
Is it possible to decompile a compiled .pyc file into a .py file?,199,python decompiling pyc compiled
How do I print bold text in Python?,198,python
"from list of integers, get number closest to a given value",198,python list sorting integer
How to install packages offline?,198,python pip freebsd easy-install python-requests
Passing HTML to template using Flask/Jinja2,198,python jinja2 flask
python capitalize first letter only,198,python capitalize letter
Django CSRF check failing with an Ajax POST request,198,python ajax django csrf
boto3 client NoRegionError: You must specify a region error only sometimes,198,python linux amazon-web-services boto3 aws-kms
Using python's eval() vs. ast.literal_eval()?,198,python eval abstract-syntax-tree
Apply vs transform on a group object,198,python pandas
Pandas get topmost n records within each group,198,python pandas greatest-n-per-group window-functions top-n
What are the differences between Pandas and NumPy+SciPy in Python? [closed],198,python numpy scipy pandas
How to convert comma-delimited string to list in Python?,198,python parsing list tuples
Python in Xcode 4+?,198,python xcode xcode7
How to filter rows in pandas by regex,198,python regex pandas
Accessing class variables from a list comprehension in the class definition,198,python python-3.x scope list-comprehension python-internals
How can I use a DLL file from Python?,198,python dll
How to read a text file into a list or an array with Python,198,python arrays list text
How does tuple comparison work in Python?,198,python comparison tuples
Find the most common element in a list,197,python list
How to get current available GPUs in tensorflow?,197,python gpu tensorflow
Applying function with multiple arguments to create a new pandas column,197,python pandas
Get the current git hash in a Python script,197,python git git-hash
How do I remove leading whitespace in Python?,197,python string whitespace trim
Max retries exceeded with URL in requests,197,python python-requests
Pythonic way to return list of every nth item in a larger list,197,list python
Format / Suppress Scientific Notation from Python Pandas Aggregation Results,197,python pandas floating-point scientific-notation number-formatting
SQLAlchemy: print the actual query,197,python sqlalchemy
How to plot in multiple subplots,197,python matplotlib subplot
How to modify a text file?,197,python file text
How to make a Python script run like a service or daemon in Linux,197,python linux scripting daemons
How can I find the number of arguments of a Python function?,197,python function
Usage of sys.stdout.flush() method,197,python sys
Python memory leaks [closed],197,python debugging memory-management memory-leaks
Error: “dictionary update sequence element #0 has length 1; 2 is required” on Django 1.4,196,python django uwsgi
Python: finding an element in a list [duplicate],196,python list
Python “SyntaxError: Non-ASCII character '\xe2' in file” [duplicate],196,python
Set Matplotlib colorbar size to match graph,196,python image matplotlib
How can I quantify difference between two images?,196,python image-processing background-subtraction image-comparison timelapse
Pandas percentage of total with groupby,196,python pandas
Replacing blank values (white space) with NaN in pandas,196,python pandas dataframe
Class method decorator with self arguments?,196,python python-decorators
Purpose of #!/usr/bin/python3 shebang,196,python scripting
How to refer to relative paths of resources when working with a code repository,196,python path relative-path
Building a minimal plugin architecture in Python,196,python architecture plugins
"In Python, how do I indicate I'm overriding a method?",196,python inheritance overriding self-documenting-code
"In Python, what happens when you import inside of a function? [duplicate]",196,python python-import
Python 3.x rounding behavior,196,python python-3.x rounding
What is the difference between a pandas Series and a single-column DataFrame?,196,python pandas
Immutable vs Mutable types,195,python types immutability mutable
How to comment out a block of Python code in Vim,195,python vim editor
Get MD5 hash of big files in Python,195,python md5 hashlib
Skipping Iterations in Python,195,python
“Cloning” row or column vectors,195,python numpy linear-algebra
Date ticks and rotation in matplotlib,195,python matplotlib
hasNext in Python iterators?,195,python iterator
"In python, why does 0xbin() return False? [duplicate]",195,python
Encoding an image file with base64,195,python base64
How to get first element in a list of tuples?,195,python list
"TypeError: a bytes-like object is required, not 'str' in python and CSV",195,python python-3.x csv beautifulsoup html-table
Why is early return slower than else?,195,python optimization python-2.7
Convert string to Enum in Python,195,python string serialization enums type-conversion
How do I override __getattr__ in Python without breaking the default behavior?,195,python getattr getproperty
What's the difference between subprocess Popen and call (how can I use them)?,195,python subprocess popen
What is the proper way to format a multi-line dict in Python?,195,python indentation code-formatting multiline
Python if not == vs if !=,195,python if-statement equality
SFTP in Python? (platform independent),195,python sftp
What is the relationship between virtualenv and pyenv?,195,python virtualenv virtualenvwrapper pyenv
"How to implement an ordered, default dict? [duplicate]",195,python dictionary
Call int() function on every list element?,194,python list type-conversion integer
Python add item to the tuple,194,python python-2.7 tuples
How do you decode base64 data in Python?,194,python base64 decode
Add string in a certain position in Python,194,python string
Does uninstalling a package with “pip” also remove the dependent packages?,194,python packages pip
How to run an .ipynb Jupyter Notebook from terminal?,194,python jupyter-notebook ipython nbconvert
pandas loc vs. iloc vs. at vs. iat?,194,python pandas performance indexing lookup
How can I access “static” class variables within class methods in Python?,194,python oop static-variables
What is the '@=' symbol for in Python?,194,python python-3.x operators matrix-multiplication python-3.5
When should Flask.g be used?,194,python flask
How to dynamically load a Python class,193,python reflection python-import
Safe method to get value of nested dictionary,193,python dictionary methods except
Round to 5 (or other number) in Python,193,python rounding
reducing number of plot ticks,193,python matplotlib
How to add hours to current time in python,193,python time add
Display a decimal in scientific notation,193,python string-formatting number-formatting scientific-notation
How can I time a code segment for testing performance with Pythons timeit?,193,python testing timeit database-tuning
How do I check the operating system in Python?,193,python linux operating-system
Read specific columns from a csv file with csv module?,193,python csv
Understanding __getitem__ method,193,python
django import error - No module named core.management,193,python django python-import pythonpath
What is “pkg-resources==0.0.0” in output of pip freeze command,193,python python-3.x pip ubuntu-16.04
ImportError: No module named pip,192,python macos pip
Pinging servers in Python,192,python python-3.x ping icmp
Asynchronous method call in Python?,192,python asynchronous
How to join two sets in one line without using “|”,192,python set
Is there a library function for Root mean square error (RMSE) in python?,192,python scikit-learn scipy
Python strptime() and timezones?,192,python datetime timezone
How to enumerate a range of numbers starting at 1,192,python
Common xlabel/ylabel for matplotlib subplots,192,python matplotlib
Model summary in pytorch,192,python pytorch
python generator “send” function purpose?,192,python
Pandas: Looking up the list of sheets in an excel file,192,python excel pandas openpyxl xlrd
How to prevent Google Colab from disconnecting?,192,python linux jupyter-notebook google-colaboratory
Extracting specific columns in numpy array,192,python syntax numpy
Iterate over object attributes in python [duplicate],192,python oop attributes iteration
How do you write tests for the argparse portion of a python module?,192,python unit-testing argparse
Is it possible to make labels appear when hovering mouse over a point in matplotlib?,192,python matplotlib
Asyncio.gather vs asyncio.wait,192,python python-asyncio
What's the correct way to sort Python `import x` and `from x import y` statements?,192,python coding-style python-import pep8
Why can I not create a wheel in python?,191,python pip setuptools python-wheel
Iterate over model instance field names and values in template,191,python django django-templates
plot a circle with pyplot,191,python matplotlib
How do I use method overloading in Python?,191,python class overloading
Compare two DataFrames and output their differences side-by-side,191,python pandas dataframe
How to access the local Django webserver from outside world,191,python django
How to find which columns contain any NaN value in Pandas dataframe,191,python pandas dataframe nan
Getting list of lists into pandas DataFrame,191,python pandas datanitro
What is sys.maxint in Python 3?,191,python python-3.x
What is the maximum float in Python?,191,python int long-integer max
How to change default Anaconda python environment,191,python anaconda conda
What's the purpose of Django setting ‘SECRET_KEY’?,191,python django security encryption
How to get all values from python enum class?,190,python enums
Python3: ImportError: No module named '_ctypes' when using Value from module multiprocessing,190,python compiler-errors installation python-3.4 failed-installation
Find where python is installed (if it isn't default dir),190,python
Why can tuples contain mutable items?,190,python list tuples immutability python-internals
pytest: assert almost equal,190,python unit-testing pytest
Numpy - add row to array,190,python arrays numpy rows
matplotlib: how to draw a rectangle on image,190,python image matplotlib
Heavy usage of Python at Google [closed],190,python
How to deep copy a list?,190,python list copy deep-copy
How to loop over grouped Pandas dataframe?,190,python pandas dataframe iteration pandas-groupby
Logical operators for boolean indexing in Pandas,190,python pandas dataframe boolean filtering
Multiprocessing: How to use Pool.map on a function defined in a class?,190,python multiprocessing pickle
What is `1..__truediv__` ? Does Python have a .. (“dot dot”) notation syntax?,190,python python-3.x syntax operators python-2.x
Difference between exit(0) and exit(1) in Python,190,python exit-code
Windows path in Python,190,python path string-literals
How to resize an image with OpenCV2.0 and Python2.6,189,python image image-processing resize opencv
How to do exponential and logarithmic curve fitting in Python? I found only polynomial fitting,189,python numpy scipy curve-fitting linear-regression
Multiple levels of 'collection.defaultdict' in Python,189,python dictionary nested
python dataframe pandas drop column using int,189,python pandas dataframe
How can I make sense of the `else` clause of Python loops?,189,python loops for-loop while-loop
ImportError: No module named matplotlib.pyplot,189,python matplotlib
What is the best way to exit a function (which has no return value) in python before the function ends (e.g. a check fails)?,189,python function return
Don't understand why UnboundLocalError occurs (closure) [duplicate],189,python scope closures global-variables
Is it possible to specify your own distance function using scikit-learn K-Means Clustering?,189,python machine-learning cluster-analysis k-means scikit-learn
"What is the difference between pyenv, virtualenv, anaconda?",189,python pip anaconda virtualenv pyenv
Python - List of unique dictionaries,188,python dictionary
Where do I call the BatchNormalization function in Keras?,188,python keras neural-network data-science batch-normalization
Binary search (bisection) in Python,188,python binary-search bisection
Python non-greedy regexes,188,python regex regex-greedy
How to update an existing Conda environment with a .yml file,188,python django anaconda conda
How to send an email with Python?,188,python email function smtplib
pandas GroupBy columns with NaN (missing) values,188,python pandas group-by pandas-groupby nan
Extract a part of the filepath (a directory) in Python,188,python directory filepath
Numpy: Get random set of rows from 2D array,188,python numpy
python: Change the scripts working directory to the script's own directory,188,python working-directory
How to assert two list contain the same elements in Python? [duplicate],188,python unit-testing
Step-by-step debugging with IPython,188,python debugging emacs ipython pdb
What to put in a python module docstring? [closed],188,python documentation module
How are Pipfile and Pipfile.lock used?,188,python pip
Retrieving parameters from a URL,187,python django parsing url
Common elements comparison between 2 lists,187,python list
Removing all non-numeric characters from string in Python,187,python numbers
random.seed(): What does it do?,187,python random random-seed
Running a specific test case in Django when your app has a tests directory,187,python django unit-testing
"Get last n lines of a file, similar to tail",187,python file file-io tail logfile
How to convert a NumPy array to PIL image applying matplotlib colormap,187,python numpy matplotlib python-imaging-library color-mapping
Changes in import statement python3,187,python python-3.x
What is the difference between pylab and pyplot? [duplicate],187,python matplotlib plot
How to limit the maximum value of a numeric field in a Django model?,186,python django django-models numbers
"Trying to mock datetime.date.today(), but not working",186,python testing datetime mocking
How to pull a random record using Django's ORM?,186,python django django-models
Remove duplicate dict in list in Python,186,python list dictionary
"How do I turn a python datetime into a string, with readable format date?",186,python datetime string-formatting
Python dict how to create key or append an element to key?,186,python python-2.7 python-3.x dictionary
Setting Django up to use MySQL,186,python mysql django debian
Python: Fetch first 10 results from a list [duplicate],186,python
python: SyntaxError: EOL while scanning string literal,186,python string string-literals
How to compare type of an object in Python?,186,python types compare
What is the inverse function of zip in python? [duplicate],186,python list numpy tuples
Is there a decorator to simply cache function return values?,186,python caching decorator memoization
Generating matplotlib graphs without a running X server [duplicate],186,python matplotlib
Mocking python function based on input arguments,186,python unit-testing mocking mockito
Python data structure sort list alphabetically,186,python list sorting alphabetical
