question,votes,tags
NumPy array initialization (fill with identical values),284,python arrays numpy
how to concatenate two dictionaries to create a new one in Python? [duplicate],284,python dictionary concatenation
Generate 'n' unique random numbers within a range [duplicate],284,python random unique
TypeError: Missing 1 required positional argument: 'self',284,python python-3.x
"Difference in boto3 between resource, client, and session?",284,python boto3
Why do python lists have pop() but not push(),284,python
How to remove \xa0 from string in Python?,283,python python-2.7 unicode beautifulsoup utf-8
How to activate virtualenv?,283,python linux virtualenv
How do you generate dynamic (parameterized) unit tests in Python?,283,python unit-testing parameterized-unit-test
correct way to define class variables in Python [duplicate],283,python class attributes
"In Python, how do you convert seconds since epoch to a `datetime` object?",283,python datetime date time epoch
"Convert a timedelta to days, hours and minutes",283,python timedelta
How to read a single character from the user?,283,python input
Why am I seeing “TypeError: string indices must be integers”?,283,python json github
Create a directly-executable cross-platform GUI app using Python,283,python user-interface deployment tkinter release-management
How can I format a decimal to always show 2 decimal places?,282,python string-formatting
How to count the number of files in a directory using Python,282,python count glob fnmatch
(unicode error) 'unicodeescape' codec can't decode bytes in position 2-3: truncated \UXXXXXXXX escape [duplicate],282,python csv unicode syntax-error
How to use a variable inside a regular expression?,282,python regex python-3.x variables escaping
How do you run a Python script as a service in Windows?,282,python windows cross-platform
Extracting just Month and Year separately from Pandas Datetime column,281,python pandas
"How do I get the object if it exists, or None if it does not exist?",281,python django django-queryset
Failed to install Python Cryptography package with PIP and setup.py,281,python cryptography pip
"In Python, how do I convert all of the items in a list to floats?",281,python list casting
How do you find the first key in a dictionary?,281,python dictionary
Python not working in the command line of git bash,281,python windows git command-line git-bash
Getting the exception value in Python,281,python exception
Set variable in jinja,281,python templates variables variable-assignment jinja2
dropping infinite values from dataframes in pandas?,281,python numpy scipy pandas
Transpose list of lists,281,python list transpose
Representing and solving a maze given an image,281,python algorithm matlab image-processing maze
Pandas read in table without headers,281,python pandas
Mapping over values in a python dictionary,281,python dictionary map-function
Python truncate a long string,280,python
Python: No acceptable C compiler found in $PATH when installing python,280,python compiler-errors virtualenv
How to use `subprocess` command with pipes,280,python linux subprocess pipe
How to find the installed pandas version,280,python pandas
Pandas Replace NaN with blank/empty string,279,python pandas dataframe nan
How to get method parameter names?,279,python decorator introspection python-datamodel
Find object in list that has attribute equal to some value (that meets any condition),279,python django list
Django development IDE [closed],279,python django ide
How to check whether a variable is a class or not?,279,python reflection
Replace non-ASCII characters with a single space,279,python unicode encoding ascii
Plot two histograms on single chart with matplotlib,278,python matplotlib plot histogram
"CSV in Python adding an extra carriage return, on Windows",278,python windows csv newline
What's the best way to parse command line arguments? [closed],278,python command-line command-line-arguments
Apply multiple functions to multiple groupby columns,278,python group-by aggregate-functions pandas
How to fix Python indentation,278,python
Python's most efficient way to choose longest string in list?,277,python list list-comprehension
How to avoid .pyc files?,277,python
"Why is 'x' in ('x',) faster than 'x' == 'x'?",277,python performance python-3.x python-internals
How do I profile memory usage in Python?,277,python memory profiling
Selecting with complex criteria from pandas.DataFrame,276,python pandas
How to select rows with one or more nulls from a pandas DataFrame without listing columns explicitly?,276,python pandas null nan
Splitting on last delimiter in Python string?,276,python string list parsing split
What do *args and **kwargs mean? [duplicate],276,python
Python list subtraction operation,275,python list
How can I mock requests and the response?,275,python mocking request
Read file from line 2 or skip header row,275,python file-io
Redirecting to URL in Flask,275,python redirect flask
_csv.Error: field larger than field limit (131072),275,python csv
Convert floats to ints in Pandas?,275,python pandas floating-point integer dataset
Is there a way to detach matplotlib plots so that the computation can continue?,275,python matplotlib plot
Django gives Bad Request (400) when DEBUG = False,275,python django
What will happen if I modify a Python script while it's running?,275,python
"Comparing two dictionaries and checking how many (key, value) pairs are equal",274,python dictionary comparison
How do I loop through a list by twos? [duplicate],274,python list loops for-loop iteration
Concatenating two lists - difference between '+=' and extend(),274,list python
PyPy — How can it possibly beat CPython?,274,python pypy language-implementation
"In Python, how do I split a string and keep the separators?",274,python regex
Access multiple elements of list knowing their index,274,python python-3.x list indexing element
ValueError: The truth value of an array with more than one element is ambiguous. Use a.any() or a.all(),274,python numpy
Get human readable version of file size?,273,python code-snippets filesize
Python JSON serialize a Decimal object,273,python json floating-point decimal
Calculating arithmetic mean (one type of average) in Python,273,python math statistics average mean
How do I copy an entire directory of files into an existing directory using Python?,273,python shutil copytree
Is generator.next() visible in Python 3?,273,python python-3.x iteration
clang error: unknown argument: '-mno-fused-madd' (python package installation failure),273,python clang pip osx-mavericks
How to print to console in pytest?,273,python unit-testing python-2.7 pytest
"Python, Matplotlib, subplot: How to set the axis range?",273,python range axis matplotlib
Convert array of indices to 1-hot encoded numpy array,272,python numpy machine-learning numpy-ndarray one-hot-encoding
How do I update a Python package?,272,python linux installation package m2crypto
Select DataFrame rows between two dates,272,python pandas
How do you extract a column from a multi-dimensional array?,272,python arrays multidimensional-array extraction
Keep only date part when using pandas.to_datetime,272,python pandas csv datetime series
How do I convert a pandas Series or index to a Numpy array? [duplicate],272,python pandas
"How can I read large text files in Python, line by line, without loading it into memory?",272,python
How can I obtain the element-wise logical NOT of a pandas Series?,272,python pandas boolean-logic
Is Python strongly typed?,271,python strong-typing weak-typing
"How to set a single, main title above all the subplots with Pyplot?",271,python matplotlib
Round number to nearest integer,271,python
What is the right way to treat argparse.Namespace() as a dictionary?,271,python dictionary duck-typing
Escaping regex string,271,python regex
PATH issue with pytest 'ImportError: No module named YadaYadaYada',270,python unit-testing pytest
How do I get Flask to run on port 80?,270,python networking flask port
"Matplotlib 2 Subplots, 1 Colorbar",270,python matplotlib subplot colorbar
Split (explode) pandas dataframe string entry to separate rows,270,python pandas numpy dataframe
Initializing a list to a known number of elements in Python [duplicate],270,python arrays list
Removing nan values from an array,270,python arrays numpy nan
Counting the number of distinct keys in a dictionary in Python,270,python dictionary count keyword
Syntax error on print with Python 3 [duplicate],270,python python-3.x
How to get a string after a specific substring?,269,python string substring
Auto reloading python Flask app upon code changes,269,python apache web flask
Anaconda vs. miniconda,269,python anaconda miniconda
Programmatically generate video or animated GIF in Python?,269,python video wxpython animated-gif
remove None value from a list without removing the 0 value,269,python list filter list-comprehension nonetype
Defining private module functions in python,268,python function module private
Inserting image into IPython notebook markdown,268,python jupyter-notebook ipython jupyter
How to sort a list of lists by a specific index of the inner list?,268,python sorting
“for line in…” results in UnicodeDecodeError: 'utf-8' codec can't decode byte,268,python python-3.x character-encoding
Extracting text from HTML file using Python,268,python html text html-content-extraction
TypeError: 'str' does not support the buffer interface,268,python string gzip
Using global variables between files?,267,python share globals
Argparse: Required arguments listed under “optional arguments”?,267,python argparse
Best way to replace multiple characters in a string?,266,python string replace
python: How do I know what type of exception occurred?,266,python exception
How to unzip a list of tuples into individual lists? [duplicate],266,python list tuples list-comprehension
How to send a “multipart/form-data” with requests in python?,266,python python-2.7 multipartform-data python-requests
Why doesn't Python have multiline comments?,266,python comments multiline
How should I log while using multiprocessing in Python?,266,python logging multiprocessing
How to install Python package from GitHub? [duplicate],265,python pip
Update a dataframe in pandas while iterating row by row,265,python pandas updates dataframe
Matplotlib tight_layout() doesn't take into account figure suptitle,265,python matplotlib
Relationship between SciPy and NumPy,265,python numpy scipy
"What are the differences between Perl, Python, AWK and sed? [closed]",264,python perl sed awk language-comparisons
Formatting “yesterday's” date in python,264,python datetime date
Convert string date to timestamp in Python,264,python datetime
Python Requests - No connection adapters,264,python python-2.7 python-requests
Why compile Python code?,264,python compilation
What's the u prefix in a Python string?,264,python syntax
Python 3: UnboundLocalError: local variable referenced before assignment [duplicate],263,python function python-3.x
Is it not possible to define multiple constructors in Python? [duplicate],263,python constructor
Listing contents of a bucket with boto3,263,python amazon-web-services amazon-s3 boto3 boto
List files ONLY in the current directory,263,python
Django set default form values,263,python django django-models django-forms
Display image as grayscale using matplotlib,263,python matplotlib grayscale
Sibling package imports,263,python packages python-import siblings
"What does Ruby have that Python doesn't, and vice versa?",263,python ruby
List comprehension on a nested list?,262,python list nested list-comprehension
Apply pandas function to column to create multiple new columns?,262,python pandas merge multiple-columns return-type
How to check if pytorch is using the GPU?,262,python memory-management gpu nvidia pytorch
Why aren't python nested functions called closures?,262,python closures nested-function
How to open a file for both reading and writing?,262,python file file-io
Display help message with python argparse when script is called without any arguments,262,python argparse
How does the “view” method work in PyTorch?,262,python memory pytorch torch tensor
Javascript equivalent of Python's zip function,262,javascript python functional-programming transpose
Is False == 0 and True == 1 an implementation detail or is it guaranteed by the language?,262,python boolean equality language-specifications
Using both Python 2.x and Python 3.x in IPython Notebook,261,python python-2.7 python-3.x ipython ipython-notebook
Abstract methods in Python [duplicate],261,python inheritance abstract
Check if string ends with one of the strings from a list,261,python string list
Disable Tensorflow debugging information,261,python tensorflow
Getting the name of a variable as a string,261,python variables
how do I insert a column at a specific column index in pandas?,261,python indexing pandas
Django template how to look up a dictionary value with a variable,261,python django templates dictionary
How can I read inputs as numbers?,261,python python-3.x python-2.7 input int
How to implement the Softmax function in Python,261,python numpy machine-learning logistic-regression softmax
Sending “User-agent” using Requests library in Python,261,python web-crawler python-requests
How to override the [] operator in Python?,261,python operator-overloading
What is the purpose of class methods?,261,python class-method
What's the difference between dist-packages and site-packages?,261,python pip easy-install package-managers
How to search and replace text in a file?,260,python python-3.x string file replace
Label encoding across multiple columns in scikit-learn,260,python pandas scikit-learn
"What blocks Ruby, Python to get Javascript V8 speed? [closed]",260,javascript python ruby performance language-design
UnicodeDecodeError: 'utf8' codec can't decode byte 0xa5 in position 0: invalid start byte,260,python json
Get IP address of visitors using Flask for Python,260,python flask ip-address werkzeug
How to use MySQLdb with Python and Django in OSX 10.6?,260,python mysql django virtualenv virtualenvwrapper
How does numpy.newaxis work and when to use it?,260,python numpy multidimensional-array array-broadcasting numpy-ndarray
Cron and virtualenv,260,python django cron virtualenv
BeautifulSoup getting href [duplicate],260,python tags beautifulsoup
Test if a variable is a list or tuple,259,python types list
How do I install Python OpenCV through Conda?,259,python opencv anaconda conda
You need to install postgresql-server-dev-X.Y for building a server-side extension or libpq-dev for building a client-side application,259,python django postgresql
Python recursive folder read,259,python scripting file-io
Python Anaconda - How to Safely Uninstall,259,python anaconda
Why does “pip install” inside Python raise a SyntaxError?,259,python pip installation
Using Pip to install packages to Anaconda Environment,259,python pip anaconda environment
Having Django serve downloadable files,259,python django django-authentication
How to count the frequency of the elements in an unordered list?,258,python counter frequency counting
What is the difference between a string and a byte string?,258,python string character byte
How to execute raw SQL in Flask-SQLAlchemy app,258,python sql sqlalchemy flask flask-sqlalchemy
How can I implement a tree in Python?,258,python data-structures tree
How to find all the subclasses of a class given its name?,258,python subclass
How to pick just one item from a generator?,258,python iterator generator python-2.x
How can I create a copy of an object in Python?,258,python oop object copy
Type annotations for *args and **kwargs,258,python type-hinting typechecking typing
How can I find where Python is installed on Windows?,257,python windows path
Appending to an empty DataFrame in Pandas?,257,python pandas
How to call a Python function from Node.js,257,python node.js express
Check if string contains only whitespace,257,python text whitespace
Is __init__.py not required for packages in Python 3.3+,257,python python-3.x package
Python: One Try Multiple Except,257,python syntax exception-handling
Why does PEP-8 specify a maximum line length of 79 characters? [closed],257,python coding-style pep8
read subprocess stdout line by line,257,python subprocess
How to uninstall a package installed with pip install --user,257,python python-3.x pip virtualenv
Plot correlation matrix using pandas,256,python pandas matplotlib data-visualization information-visualization
Virtualenv Command Not Found,256,python macos virtualenv
"In Python, how do you convert a `datetime` object to seconds?",256,python python-2.7
Add column to dataframe with constant value,256,python pandas dataframe
How to remove specific elements in a numpy array,256,python arrays numpy
Best way to save a trained model in PyTorch?,256,python serialization deep-learning pytorch tensor
What is the purpose of “pip install --user …”?,256,python python-3.x pip virtualenv
Python try…except comma vs 'as' in except,256,python python-2.6
What's the best solution for OpenID with Django? [closed],256,python django openid
How do I replace whitespaces with underscore?,255,python regex django
multiple prints on the same line in Python,255,python printing stdout line-breaks
How do you create a daemon in Python?,255,python daemon
Pass a list to a function to act as multiple arguments,255,python list parameter-passing
ImportError: No module named PIL,254,python python-imaging-library easy-install
How do I check if I'm running on Windows in Python? [duplicate],254,python platform platform-specific
What is the global interpreter lock (GIL) in CPython?,254,python python-internals gil
Python “raise from” usage,254,python python-3.x syntax exception-handling
Are tuples more efficient than lists in Python?,253,python performance list tuples python-internals
How to check if one of the following items is in a list?,253,python
What is the result of % in Python?,253,python python-2.7 syntax operators modulo
Is there shorthand for returning a default value if None in Python? [duplicate],253,python
Extracting specific selected columns to new DataFrame as a copy,253,python pandas chained-assignment
Relative imports - ModuleNotFoundError: No module named x,253,python python-3.x package python-import relative-import
How to calculate the angle between a line and the horizontal axis?,253,c# python trigonometry
Moving matplotlib legend outside of the axis makes it cutoff by the figure box,253,python matplotlib legend
Daemon Threads Explanation,252,python multithreading daemon python-multithreading
How to add property to a class dynamically?,252,python properties runtime monkeypatching
append new row to old csv file python,252,python csv append writer
Check if item is in an array / list,252,python arrays contains
socket.error: [Errno 48] Address already in use,251,python macos simplehttpserver
Understanding NumPy's einsum,251,python arrays numpy multidimensional-array numpy-einsum
ImportError: No module named 'Tkinter',251,python tkinter
Creating an empty list in Python,251,python performance list coding-style timeit
How do I implement interfaces in python?,251,python oop
How to load/edit/run/save text files (.py) into an IPython notebook cell?,251,python jupyter-notebook ipython jupyter
What is the difference between join and merge in Pandas?,250,python pandas dataframe join
"Using Python's os.path, how do I go up one directory?",250,python django
Making a request to a RESTful API using python,250,python rest elasticsearch restapi
Python requests - print entire http request (raw)?,250,python http python-requests
Find row where values for column is maximal in a pandas DataFrame,250,python pandas dataframe row argmax
How to normalize an array in NumPy to a unit vector?,250,python numpy scikit-learn statistics normalization
How do I check that multiple keys are in a dict in a single pass?,249,python dictionary
"Class method differences in Python: bound, unbound and static",249,python static-methods
Using Pandas to pd.read_excel() for multiple worksheets of the same workbook,249,python excel pandas dataframe xlsx
Convert python datetime to epoch with strftime,249,python datetime utc epoch strftime
Programmatically stop execution of python script? [duplicate],249,python
"builtins.TypeError: must be str, not bytes",249,python python-3.x lxml
Broken references in Virtualenvs,249,python macos virtualenv homebrew dyld
What is the problem with shadowing names defined in outer scopes?,249,python pycharm shadowing
error UnicodeDecodeError: 'utf-8' codec can't decode byte 0xff in position 0: invalid start byte,249,python python-3.x utf-8
Detect and exclude outliers in Pandas data frame,248,python pandas filtering dataframe outliers
Why use Abstract Base Classes in Python?,248,python abstract-class abc
How often does python flush to a file?,248,python file flush
Django Template Variables and Javascript,248,javascript python django google-app-engine django-templates
Import Error: No module named numpy,248,python python-3.x numpy import scipy
Could not find a version that satisfies the requirement tensorflow,248,python python-3.x python-2.7 tensorflow pip
why should I make a copy of a data frame in pandas,248,python pandas chained-assignment
pip install - locale.Error: unsupported locale setting,247,python python-3.x centos pip
Modify tick label text,247,python matplotlib
Storing Python dictionaries,247,python json dictionary save pickle
How to call a shell script from python code?,247,python shell
How to check if all elements of a list match a condition?,247,python list for-loop while-loop
Read only the first line of a file?,247,python file
Safest way to convert float to integer in python?,247,python math integer python-2.x
How to import a Python class that is in a directory above?,247,python module directory python-import
Why isn't my Pandas 'apply' function referencing multiple columns working? [closed],247,python python-2.7 pandas dataframe apply
How to determine the encoding of text?,247,python encoding text-files
"What's the proper way to install pip, virtualenv, and distribute for Python?",247,python virtualenv setuptools distribute
How to split a dataframe string column into two columns?,246,python dataframe pandas
Raise warning in Python without interrupting program,246,python exception error-handling warnings
How can I convert an RGB image into grayscale in Python?,246,python matplotlib
Dictionaries and default values,246,python dictionary coding-style
How to append multiple values to a list in Python,246,python list
Convert Pandas column containing NaNs to dtype `int`,246,python pandas na
Exit codes in Python,246,python exit-code
How do I filter ForeignKey choices in a Django ModelForm?,246,python django django-forms
How to import module when module name has a '-' dash or hyphen in it?,246,python import module hyphen
"Django - what is the difference between render(), render_to_response() and direct_to_template()?",246,python django
What is pip's equivalent of `npm install package --save-dev`?,246,python node.js pip
How to change dataframe column names in pyspark?,245,python apache-spark pyspark pyspark-sql
Fastest way to get the first object from a queryset in django?,245,python django performance django-models
How to get indices of a sorted array in Python,245,python indexing sorted
Seaborn plots not showing up,245,python matplotlib seaborn
How do Python's any and all functions work?,245,python
Best practices for adding .gitignore file for Python projects? [closed],245,python django git pygtk gitignore
How to create module-wide variables in Python? [duplicate],245,python variables singleton module scope
ModuleNotFoundError: What does it mean __main__ is not a package?,245,python module python-3.6 python-import
'str' object has no attribute 'decode'. Python 3 error?,245,python python-3.x imaplib
How to select a drop-down menu value with Selenium using Python?,244,python selenium selenium-webdriver webdriver html-select
Deleting folders in python recursively,244,python directory
Skip the headers when editing a csv file using Python,244,python python-2.7 csv
How to handle errors with boto3?,244,python amazon-web-services boto boto3
Configuring so that pip install can work from github,244,python git pip
What does “hashable” mean in Python?,244,python
input() error - NameError: name '…' is not defined,244,python python-2.7 input nameerror
Running Python on Windows for Node.js dependencies,243,python windows node.js npm
Convert UTC datetime string to local datetime,243,python datetime utc localtime
How to convert an integer to a string in any base?,243,python base radix
Python function overloading,243,python class oop overloading multiple-dispatch
How can I recover the return value of a function passed to multiprocessing.Process?,243,python python-multiprocessing
Python integer division yields float,243,python integer python-3.x division
How to get http headers in flask?,243,python http flask http-headers authorization
TypeError: unhashable type: 'dict',243,python
How to print a dictionary's key?,242,python dictionary key
How to read specific lines from a file (by line number)?,242,python file line
How can I check if my python object is a number? [duplicate],242,python types numbers
How to check if a float value is a whole number,242,python floating-point
How to process SIGTERM signal gracefully?,242,python daemon sigterm start-stop-daemon
Convert tuple to list and back,242,python list tuples
How to implement common bash idioms in Python? [closed],242,python bash shell
Convert a tensor to numpy array in Tensorflow?,242,python numpy tensorflow
How can I check for Python version in a program that uses new language features?,242,python version
Why does Python's hash of infinity have the digits of π?,242,python math hash floating-point pi
