question,votes,tags
Why are there no ++ and -- operators in Python?,471,python operators
Download large file in python with requests,470,python download stream python-requests
Multiple variables in a 'with' statement?,470,python with-statement
How to read a file without newlines?,470,python line-breaks readlines
Difference between __getattr__ vs __getattribute__,470,python getattr getattribute
Elegant ways to support equivalence (“equality”) in Python classes,469,python equality equivalence
Python datetime to string without microsecond component,468,python datetime datetime-format
Get all object attributes in Python? [duplicate],466,python introspection python-2.6
Automatically create requirements.txt,465,python dependencies python-import requirements.txt
Expanding tuples into arguments,465,python tuples parameter-passing
Most efficient way to map function over numpy array,465,python performance numpy
Why do some functions have underscores “__” before and after the function name?,465,python function methods double-underscore
Split string every nth character?,464,python string split
Python: How to ignore an exception and proceed? [duplicate],464,python exception
Pretty printing XML in Python,464,python xml pretty-print
Reimport a module in python while interactive,464,python
How do I calculate the date six months from the current date using the datetime Python module?,462,python datetime
Adding days to a date in Python,462,python date datetime timedelta
How can I get the named parameters from a URL using Flask?,461,python web-services flask url-parameters
Selecting a row of pandas series/dataframe by integer index,461,python pandas dataframe indexing
How to find all occurrences of an element in a list,460,python list
Should you always favor xrange() over range()?,460,python range xrange
How to check if an object is a list or tuple (but not string)?,459,python list types assert
Creating a range of dates in Python,458,python datetime date
Python Pandas Error tokenizing data,458,python csv pandas
Sorting list based on values from another list,458,python list sorting
How to pivot a dataframe?,458,python pandas group-by pivot pandas-groupby
How to rename a file using Python,457,python file-rename
What is the reason for having '//' in Python? [duplicate],457,python division
What is a Python equivalent of PHP's var_dump()? [duplicate],457,php python debugging
Determine if variable is defined in Python [duplicate],455,python variables defined
"What do the python file extensions, .pyc .pyd .pyo stand for?",454,python pyc
No module named MySQLdb,453,python django python-2.x
Should import statements always be at the top of a module?,453,python optimization pep8
What does it mean if a Python object is “subscriptable” or not?,453,python terminology
Difference between exit() and sys.exit() in Python,453,python exit
Read .mat files in Python,452,python matlab file-io scipy mat-file
Python - Create list with numbers between 2 values?,452,python list
Convert a list of characters into a string,452,python string
Where does pip install its packages?,451,python django pip virtualenv
ISO time (ISO 8601) in Python,451,python datetime iso8601
Check if all elements in a list are identical,450,python algorithm comparison
Can a website detect when you are using Selenium with chromedriver?,450,javascript python google-chrome selenium selenium-chromedriver
Changing one character in a string,448,python string
How to sort a list of strings?,448,python string sorting
What is the python “with” statement designed for?,448,python language-features with-statement
Generator expressions vs. list comprehensions,447,python list-comprehension generator
How to install lxml on Ubuntu,446,python ubuntu lxml libxml2 easy-install
Change the name of a key in dictionary,446,python dictionary sequence
How can I get list of values from dict?,446,python list dictionary
How to convert strings into integers in Python?,446,python string integer
Iterating through a range of dates in Python,445,python date datetime iteration date-range
How to write inline if statement for print?,445,python if-statement inline
Can I get JSON to load into an OrderedDict?,445,python json load ordereddictionary
Convert JSON string to dict using Python,444,python json string
ValueError: invalid literal for int() with base 10: '',444,python
Python's time.clock() vs. time.time() accuracy?,442,python time
Append values to a set in Python,441,python set append
How do I remove a substring from the end of a string?,441,python string
How to find out if a Python object is a string?,441,python string types compatibility
Working with UTF-8 encoding in Python source [duplicate],440,python encoding utf-8 character-encoding
How to invoke the super constructor in Python?,440,python class inheritance constructor superclass
"return, return None, and no return at all?",440,python null return
How can I compare two lists in python and return matches,438,python list
How do I find the time difference between two datetime objects in python?,438,python datetime date-arithmetic
How to install python3 version of package via pip on Ubuntu?,437,python ubuntu python-3.x ubuntu-12.04 pip
Get the last 4 characters of a string [duplicate],437,python string
How to find all occurrences of a substring?,437,python regex string
Plot logarithmic axes with matplotlib in python,437,python matplotlib scale logarithm
How to get the return value from a thread in python?,435,python multithreading
How to compare two dates?,435,python datetime
The difference between sys.stdout.write and print?,435,python printing stdout
logger configuration to log to file and print to stdout,434,python file logging stdout
Unresolved reference issue in PyCharm,433,python ide pycharm
Remap values in pandas column with a dict,433,python dictionary pandas remap
What's the pythonic way to use getters and setters?,432,python getter-setter
Printing Lists as Tabular Data,432,python
Run function from the command line,432,python function command-line
What is the standard way to add N seconds to datetime.time in Python?,432,python datetime time math
beyond top level package error in relative import,432,python import package
Hiding axis text in matplotlib plots,431,python matplotlib plot
How do I create variable variables?,431,python variable-variables
Remove all the elements that occur in one list from another,430,python list
How to save a Python interactive session?,430,python shell read-eval-print-loop interactive-session
Explaining Python's '__enter__' and '__exit__',429,python oop with-statement contextmanager
How to download image using requests,427,python urllib2 python-requests
How do I increase the cell width of the Jupyter/ipython notebook in my browser?,427,python ipython ipython-notebook jupyter-notebook jupyter
"pandas create new column based on values from other columns / apply a function of multiple columns, row-wise",425,python pandas numpy apply
How do I access command line arguments?,425,python command-line command-line-arguments
Python Dictionary Comprehension,424,python dictionary list-comprehension
How to delete rows from a pandas DataFrame based on a conditional expression [duplicate],423,python pandas
Suppress InsecureRequestWarning: Unverified HTTPS request is being made in Python2.6,423,python python-2.6 suppress-warnings urllib3 pyvmomi
Find index of last occurrence of a substring in a string,423,python string
Python unittest - opposite of assertRaises?,423,python unit-testing
'pip' is not recognized as an internal or external command,422,python django windows pip
Is there a way to perform “if” in python's lambda?,422,python lambda python-2.6
How to declare and add items to an array in Python?,422,python arrays
How to re import an updated package while in Python Interpreter? [duplicate],422,python
Deep copy of a dict in python,421,python python-3.x
Remove all occurrences of a value from a list?,420,python list
How do I execute a string containing Python code in Python?,420,python string exec
Print a list in reverse order with range()?,418,python list range reverse
List attributes of an object [duplicate],417,python class python-3.x
Circular (or cyclic) imports in Python,417,python circular-dependency cyclic-reference
Is there a “not equal” operator in Python?,417,python operators
How do I change the figure size with subplots?,416,python matplotlib
How do I get the path of the Python script I am running in? [duplicate],416,python path
Find all packages installed with easy_install/pip?,414,python pip easy-install pypi
When is del useful in Python?,414,python dictionary python-internals del
How do I get the parent directory in Python?,413,python
Append a dictionary to a dictionary [duplicate],413,python dictionary
Case insensitive regular expression without re.compile?,412,python regex case-sensitive case-insensitive
Reloading submodules in IPython,412,python ipython
Pandas read_csv low_memory and dtype options,412,python parsing numpy pandas dataframe
How to reset index in a pandas dataframe? [duplicate],411,python indexing pandas dataframe
Is it possible to use pip to install a package from a private GitHub repository?,411,python git github pip
Pandas - How to flatten a hierarchical index in columns,410,python pandas dataframe
Installing Python packages from local file system folder to virtualenv with pip,410,python pip
How to check whether a pandas DataFrame is empty?,409,python pandas dataframe
What does “SyntaxError: Missing parentheses in call to 'print'” mean in Python?,409,python python-3.x
How to use the pass statement,408,python
Rename multiple files in a directory in Python [duplicate],408,python file-io file-rename
How do I find out my PYTHONPATH using Python?,407,python python-module pythonpath
Reading binary file and looping over each byte,407,python file-io binary
What is memoization and how can I use it in Python?,407,python memoization
Simple Digit Recognition OCR in OpenCV-Python,405,python opencv numpy computer-vision ocr
Sorting arrays in NumPy by column,404,python arrays sorting numpy scipy
How can I convert a datetime object to milliseconds since epoch (unix time) in Python?,404,python datetime epoch
Python argparse command line flags without arguments,404,python command-line-arguments argparse
Python module for converting PDF to text [closed],404,python pdf text-extraction pdf-scraping
"How to add to the PYTHONPATH in Windows, so it finds my modules/packages?",403,python windows environment-variables pythonpath
How can I selectively escape percent (%) in Python strings?,403,python escaping python-2.7
How do I get a Cron like scheduler in Python? [closed],403,python cron scheduled-tasks
Numpy array dimensions,403,python arrays numpy dimensions
How to extract the substring between two markers?,402,python string substring
How to get POSTed JSON in Flask?,402,python json post flask
Automatically creating directories with file output [duplicate],402,python file-io
Implement touch using Python?,402,python utility
Pandas - Get first row value of a given column,402,python pandas indexing head
Python List vs. Array - when to use?,402,python arrays list
Python Requests throwing SSLError,401,python ssl python-requests urllib3
How to write a Python module/package?,401,python python-2.7 python-module
Flattening a shallow list in Python [duplicate],401,python list-comprehension
setup script exited with error: command 'x86_64-linux-gnu-gcc' failed with exit status 1,400,python gcc pip odoo-server
How can I check the syntax of Python script without executing it?,400,python compilation syntax-checking
JSON datetime between Python and JavaScript,400,javascript python json
How to get current CPU and RAM usage in Python?,400,python system cpu status ram
Sum a list of numbers in Python,400,python list sum
Why is my xlabel cut off in my matplotlib plot?,399,python matplotlib
"Pylint, PyChecker or PyFlakes? [closed]",399,python pylint pep8 pyflakes pychecker
How to uninstall Python 2.7 on a Mac OS X 10.6.4?,398,python macos uninstallation python-2.7
How to insert newlines on argparse help text?,398,python argparse
How to use timeit module,397,python time timeit
How do I create test and train samples from one dataframe with pandas?,396,python python-2.7 pandas dataframe
Converting dictionary to JSON,396,python json python-2.7 dictionary
What is __main__.py?,396,python
Python dictionary from an object's fields,395,python dictionary attributes object metaprogramming
What is the difference between “is None” and “== None”,395,python
What is an alternative to execfile in Python 3?,394,python python-3.x
Why is there no tuple comprehension in Python?,394,python tuples list-comprehension dictionary-comprehension set-comprehension
What are the differences between json and simplejson Python modules?,394,python json simplejson
How to get week number in Python?,393,python datetime week-number
How do I disable log messages from the Requests library?,393,python logging python-requests verbosity
Convert base-2 binary number string to int,393,python
How can I color Python logging output?,392,python logging colors
Passing a dictionary to a function as keyword parameters,392,python function dictionary parameters keyword
"How to select all columns, except one column in pandas?",391,python pandas
How to clear the interpreter console?,391,python windows console
What is the best way to compare floats for almost-equality in Python?,391,python floating-point
Substitute multiple whitespace with single whitespace in Python [duplicate],390,python substitution removing-whitespace
No Multiline Lambda in Python: Why not?,390,python syntax lambda
How to change legend size with matplotlib.pyplot,390,python size matplotlib legend
How do I install the yaml package for Python?,390,python python-2.7 yaml pip pyyaml
Which is the preferred way to concatenate a string in Python?,390,python string python-3.x concat
Improve subplot size/spacing with many subplots in matplotlib,389,python matplotlib
What is the purpose of meshgrid in Python / NumPy?,389,python numpy multidimensional-array mesh numpy-ndarray
Generating an MD5 checksum of a file,389,python md5 checksum hashlib
How do I get list of methods in a Python class?,388,python
Check if string matches pattern,388,python regex string-matching
Python date string to date object,388,python date
Split by comma and strip whitespace in Python,388,python whitespace strip
How to query as GROUP BY in django?,388,python django django-models
Selecting/excluding sets of columns in pandas [duplicate],387,python pandas dataframe
How to install PIL with pip on Mac OS?,386,python macos python-2.7 installation python-imaging-library
How to check if a column exists in Pandas,386,python pandas dataframe
How to format a floating number to fixed width in Python,386,python string numbers number-formatting
Does reading an entire file leave the file handle open?,386,python file-io filehandle
What's the best practice using a settings file in Python? [closed],386,python parsing configuration yaml settings
time.sleep — sleeps thread or process?,386,python multithreading time sleep python-internals
Find nearest value in numpy array,385,python search numpy
How to input a regex in string.replace?,385,python regex string replace
Get the first item from an iterable that matches a condition,385,python iterator
How to detect a Christmas Tree?,385,c++ python opencv image-processing computer-vision
Convert Python dict into a dataframe,384,python pandas dataframe
Python Progress Bar,384,python
"How to embed image or picture in jupyter notebook, either from a local machine or from a web resource?",384,python python-3.x image jupyter-notebook jupyter
"How to get current time in python and break up into year, month, day, hour, minute?",384,python python-2.7 datetime time
Get the cartesian product of a series of lists?,384,python list cartesian-product
join list of lists in python [duplicate],383,python
How to set Python's default version to 3.x on OS X? [duplicate],382,python python-3.x macos installation
Is it possible to make abstract classes in Python?,382,python class inheritance abstract-class abstract
What are the differences between numpy arrays and matrices? Which one should I use?,382,python arrays matrix numpy
Fastest way to list all primes below N,381,python math optimization primes
Python nonlocal statement,381,python closures global python-nonlocal
Count the frequency that a value occurs in a dataframe column,380,python pandas frequency
How to reversibly store and load a Pandas dataframe to/from disk,380,python pandas dataframe
What is the best way to call a script from another script?,380,python
Does Python support short-circuiting?,380,python boolean-logic short-circuiting
Stripping everything but alphanumeric chars from a string in Python,379,python string non-alphanumeric
What's the difference between `raw_input()` and `input()` in Python 3?,379,python python-3.x input
How can I rename a conda environment?,379,python anaconda conda
What is the best way to repeatedly execute a function every x seconds? [closed],378,python timer
Get list from pandas dataframe column or row?,378,python list pandas
Splitting on first occurrence,377,python split
How do you express binary literals in Python?,377,python syntax binary integer literals
defaultdict of defaultdict?,376,python collections
Can a variable number of arguments be passed to a function?,376,python
Is there a standardized method to swap two variables in Python?,376,python syntax swap conventions
Pandas conditional creation of a series/dataframe column,375,python pandas numpy dataframe
pandas: filter rows of DataFrame with operator chaining,375,python pandas dataframe
Python setup.py develop vs install,375,python setuptools
How to correct TypeError: Unicode-objects must be encoded before hashing?,375,python python-3.x unicode syntax-error hashlib
Download file from web in Python 3,374,python python-3.x
Installing python module within code,374,python pip python-module pypi
Threading pool similar to the multiprocessing Pool?,374,python multithreading missing-features
"Run a Python script from another Python script, passing in arguments [duplicate]",374,python
Rotate axis text in python matplotlib,373,python matplotlib
How to round to 2 decimals with Python?,373,python rounding
how to check if a file is a directory or regular file in python? [duplicate],373,python
How do I get a value of datetime.today() in Python that is “timezone aware”?,373,python datetime date timezone
Timeout on a function call,373,python multithreading timeout python-multithreading
Extract subset of key-value pairs from Python dictionary object?,373,python dictionary associative-array
Converting Python dict to kwargs?,373,python dictionary keyword-argument
Get lengths of a list in a jinja2 template,373,python jinja2
"How do I specify new lines on Python, when writing on files?",373,python line-breaks file-writing
Hide all warnings in ipython,372,python warnings ipython
How to pretty-print a numpy.array without scientific notation and with given precision?,372,python numpy python-2.x pretty-print
How do I detect the Python version at runtime? [duplicate],371,python
Why do we need the “finally” clause in Python?,371,python exception-handling try-finally
What is the difference between an expression and a statement in Python?,371,python expression
Python Graph Library [closed],371,python graph
How can I use the apply() function for a single column?,370,python pandas dataframe
What is the difference between 'SAME' and 'VALID' padding in tf.nn.max_pool of tensorflow?,369,python tensorflow deep-learning
Remove xticks in a matplotlib plot?,369,python matplotlib plot
Python list sort in descending order,369,python sorting reverse
Reading JSON from a file?,369,python json
How can I find all matches to a regular expression in Python?,369,python regex search
JSONDecodeError: Expecting value: line 1 column 1 (char 0),369,python json curl
Understanding Keras LSTMs,369,python deep-learning keras lstm
What does numpy.random.seed(0) do?,368,python numpy
How to group dataframe rows into list in pandas groupby,368,python pandas list aggregate pandas-groupby
How to pretty print nested dictionaries?,366,python dictionary
Redirect stdout to a file in Python?,366,python stdout
How to properly assert that an exception gets raised in pytest?,366,python unit-testing testing pytest
Check if something is (not) in a list in Python,366,python list conditional membership
How do I run all Python unit tests in a directory?,365,python unit-testing testing python-unittest
"How can I convert a character to a integer in Python, and viceversa?",365,python integer char type-conversion
"'too many values to unpack', iterating over a dict. key=>string, value=>list",365,python
How to overload __init__ method based on argument type?,365,python constructor operator-overloading
How to empty a list?,364,python list
"Convert DataFrame column type from string to datetime, dd/mm/yyyy format",364,python pandas dataframe datetime-format python-datetime
Matplotlib make tick labels font size smaller,363,python matplotlib
filename.whl is not supported wheel on this platform,362,python pip
"django order_by query set, ascending and descending",362,python django sorting
TypeError: method() takes 1 positional argument but 2 were given,362,python python-3.x methods arguments self
Get the key corresponding to the minimum value within a dictionary,361,python dictionary min minimum idioms
Converting Epoch time into the datetime,361,python
"Difference between numpy.array shape (R, 1) and (R,)",361,python numpy matrix multidimensional-array
Python String and Integer concatenation [duplicate],361,python string integer concatenation
Python Pandas: Get index of rows which column matches certain value,361,python indexing pandas
What's the difference between select_related and prefetch_related in Django ORM?,361,python django django-models django-orm
"How to add default parameter to functions, when using Type Hint?",361,python python-3.x type-hinting
How to tell if tensorflow is using gpu acceleration from inside python shell?,360,python tensorflow ubuntu gpu
Best way to format integer as string with leading zeros? [duplicate],360,python string-formatting
Measuring elapsed time with the Time module,360,python time elapsed
"Matplotlib plots: removing axis, legends and white spaces",360,python matplotlib
Argparse: Way to include default values in '--help'?,360,python argparse
how to sort pandas dataframe from one column,360,python pandas dataframe sorting time
How can I tell if a string repeats itself in Python?,359,python string pattern-matching
Re-ordering columns in pandas dataframe based on column name [duplicate],359,python pandas dataframe
How to take the first N items from a generator or list? [duplicate],359,python list generator
How to add an extra column to a NumPy array,358,python numpy
Why doesn't os.path.join() work in this case?,358,python path
Running Bash commands in Python,358,python bash
How to terminate a python subprocess launched with shell=True,358,python linux subprocess kill-process
Is there a Python equivalent of the C# null-coalescing operator?,358,python null-coalescing-operator
Comprehensive beginner's virtualenv tutorial? [closed],358,python virtualenv
Python 3 ImportError: No module named 'ConfigParser',357,python python-3.x
Permanently add a directory to PYTHONPATH?,357,python windows pythonpath
Showing the stack trace from a running Python application,357,python debugging stack-trace traceback
How do I create an empty array/matrix in NumPy?,357,python arrays numpy
What is the difference between Numpy's array() and asarray() functions?,357,python arrays numpy
Why is “except: pass” a bad programming practice?,356,python exception error-handling try-catch
Can't subtract offset-naive and offset-aware datetimes,356,python postgresql datetime timezone
How can I check if a key exists in a dictionary? [duplicate],356,python
How can I make one python file run another? [duplicate],356,python
Is there a Python equivalent to Ruby's string interpolation?,356,python string-interpolation language-comparisons
Python locale error: unsupported locale setting,355,python locale ubuntu-11.04
Removing Conda environment,355,python jupyter conda
Is a Python list guaranteed to have its elements stay in the order they are inserted in?,355,python
Converting NumPy array into Python List structure?,355,python numpy
Unicode (UTF-8) reading and writing to files in Python,354,python unicode utf-8 io
How can I filter a Django query with a list of values?,353,python django django-queryset
Setting the correct encoding when piping stdout in Python,353,python encoding terminal stdout python-2.x
Breaking out of nested loops [duplicate],352,python loops nested-loops
Python 3: ImportError “No Module named Setuptools”,352,python module package setup.py python-3.3
What is the most efficient way to loop through dataframes with pandas?,352,python pandas performance dataframe for-loop
Python dictionary: are keys() and values() always the same order?,352,python
How do Python functions handle the types of the parameters that you pass in?,351,python function parameters
How can I create an object and add attributes to it?,351,python class object attributes
How to convert JSON data into a Python object,350,python json django
Store output of subprocess.Popen call in a string,350,python subprocess
How do I watch a file for changes?,350,python file pywin32 watch
How to convert 2D float numpy array to 2D int numpy array?,350,python numpy
Why is IoC / DI not common in Python?,350,python design-patterns dependency-injection inversion-of-control architecture
"Why does range(start, end) not include end?",350,python range
"Converting between datetime, Timestamp and datetime64",349,python datetime numpy pandas
