question,votes,tags
What does the “yield” keyword do?,11215,python iterator generator yield coroutine
What does if __name__ == “__main__”: do?,6848,python namespaces main python-module idioms
Does Python have a ternary conditional operator?,6706,python operators ternary-operator conditional-operator
What are metaclasses in Python?,6204,python oop metaclass python-class python-datamodel
How do I check whether a file exists without exceptions?,6176,python file file-exists
How do I merge two dictionaries in a single expression (taking union of dictionaries)?,5686,python dictionary merge
How to execute a program or call a system command from Python,5335,python shell terminal subprocess command
How can I safely create a nested directory in Python?,4757,python exception path directory operating-system
Accessing the index in 'for' loops?,4143,python loops list
How to make a flat list out of a list of lists?,4107,python list multidimensional-array flatten
Difference between staticmethod and classmethod,3966,python oop methods python-decorators
Understanding slice notation,3853,python list slice iterable
Finding the index of an item in a list,3647,python list indexing
Does Python have a string 'contains' substring method?,3596,python string substring contains
Iterating over dictionaries using 'for' loops,3535,python dictionary
How do I list all files of a directory?,3467,python directory
How do I sort a dictionary by value?,3417,python sorting dictionary
Using global variables in a function,3388,python global-variables scope
How to get the current time in Python,3274,python datetime time
How do I check if a list is empty?,3231,python list
Catch multiple exceptions in one line (except block),3181,python exception exception-handling
What is the difference between Python's list methods append and extend?,3114,python list data-structures append extend
What is the difference between __str__ and __repr__?,3047,python magic-methods repr
How can I add new keys to a dictionary?,3026,python dictionary lookup
How do I concatenate two lists in Python?,2955,python list concatenation
How can a file be copied?,2936,python file copy filesystems file-copying
How can I make a time delay in Python? [duplicate],2934,python python-3.x delay sleep timedelay
How to make function decorators and chain them together?,2907,python decorator python-decorators
Convert bytes to a string,2902,python string python-3.x
How do I pass a variable by reference?,2886,python reference parameter-passing pass-by-reference
“Least Astonishment” and the Mutable Default Argument,2872,python language-design default-parameters least-astonishment
List changes unexpectedly after assignment. Why is this and how can I prevent it?,2860,python list reference copy clone
How to iterate over rows in a DataFrame in Pandas,2790,python pandas dataframe
Understanding Python super() with __init__() methods [duplicate],2780,python class oop inheritance super
What is __init__.py for?,2772,python module package python-packaging
What does ** (double star/asterisk) and * (star/asterisk) do for parameters?,2696,python syntax parameter-passing variadic-functions argument-unpacking
Check if a given key already exists in a dictionary,2680,python dictionary
How can I install pip on Windows?,2625,python windows installation pip easy-install
How do you split a list into evenly sized chunks?,2567,python list split chunks
How do I select rows from a DataFrame based on column values?,2564,python pandas dataframe
Manually raising (throwing) an exception in Python,2563,python exception
How to delete a file or folder?,2562,python file-io directory delete-file
How do you change the size of figures drawn with Matplotlib?,2517,python graph matplotlib plot visualization
Find current directory and file's directory [duplicate],2514,python directory
How to print colored text to the terminal?,2499,python terminal output ansi-colors
How to access environment variable values?,2493,python environment-variables
How do I parse a string to a float or int?,2467,python parsing floating-point type-conversion integer
Converting string into datetime,2446,python datetime
Why is “1000000000000000 in range(1000000000000001)” so fast in Python 3?,2432,python performance python-3.x range python-internals
Getting the last element of a list,2412,python list indexing
How do I get a substring of a string in Python?,2362,python string substring
How to upgrade all Python packages with pip,2300,python pip
How do I lowercase a string in Python?,2279,python string uppercase lowercase
Renaming columns in Pandas,2233,python pandas replace dataframe rename
How can I remove a key from a Python dictionary?,2212,python dictionary data-structures unset
How do I sort a list of dictionaries by a value of the dictionary?,2210,python list sorting dictionary data-structures
Are static class variables possible in Python?,2150,python class oop static class-variables
How to print without newline or space?,2108,python newline
Is there a way to run Python on Android?,2088,android python jython ase android-scripting
How do I get the number of elements in a list?,2070,python list
How to read a file line-by-line into a list?,2026,python string file readlines
Calling a function of a module by using its name (a string),1997,python object
Why is reading lines from stdin much slower in C++ than Python?,1988,python c++ benchmarking iostream getline
How to randomly select an item from a list?,1984,python list random
How to know if an object has an attribute in Python,1927,python attributes
Determine the type of an object?,1919,python dictionary types typeof
Limiting floats to two decimal points,1918,python floating-point rounding precision
How to leave/exit/deactivate a Python virtualenv,1889,python virtualenv virtualenvwrapper
Why is it string.join(list) instead of list.join(string)?,1879,python string list
How can I remove a trailing newline?,1839,python newline trailing
How can I print literal curly-brace characters in a string and also use .format on it?,1831,python string format string-formatting curly-braces
Static methods in Python?,1829,python static-methods
How to determine a Python variable's type?,1819,python types unsigned signed 16-bit
Importing files from different folder,1817,python importerror python-import
How to remove an element from a list by index,1778,python list indexing
How can I count the occurrences of a list item?,1764,python list count
How do you append to a file?,1764,python file append
How do I check if a string is a number (float)?,1754,python casting floating-point type-conversion
Replacements for switch statement in Python?,1717,python switch-statement
Delete an element from a dictionary,1716,python dictionary del
Meaning of @classmethod and @staticmethod for beginner? [duplicate],1703,python oop static-methods class-method
How to pad zeroes to a string?,1691,python string zero-padding
How to check if the string is empty?,1674,python string comparison-operators
How do I install pip on macOS or OS X?,1672,python macos pip installation
Getting the class name of an instance?,1667,python introspection instanceof python-datamodel
Delete a column from a Pandas DataFrame,1659,python pandas dataframe
How do you read from stdin?,1576,python stdin
Installing specific package versions with pip,1562,python mysql pip pypi mysql-python
Pythonic way to create a long multi-line string,1538,python string multiline multilinestring
How to measure elapsed time in Python?,1534,python performance measure timeit
Generate random integers between 0 and 9,1529,python random integer
How to print to stderr in Python?,1499,python printing stderr zen-of-python
Extracting extension from filename in Python,1494,python filenames file-extension
Why can't Python parse this JSON data?,1493,python json parsing
Random string generation with upper case letters and digits,1491,python string random
Use of *args and **kwargs [duplicate],1480,python args keyword-argument
Proper way to declare custom exceptions in modern Python?,1467,python exception custom-exceptions
What's the canonical way to check for type in Python?,1462,python types
Converting integer to string in Python,1457,python string integer
What is the meaning of single and double underscore before an object name?,1453,python oop naming-conventions identifier
How do I convert two lists into a dictionary?,1442,python list dictionary type-conversion
Reverse a string in Python,1438,python string
fatal error: Python.h: No such file or directory,1429,python gcc python-c-api
Why do Python classes inherit object?,1429,python class oop object inheritance
How can you profile a Python script?,1424,python performance optimization time-complexity profiling
Hidden features of Python [closed],1417,python hidden-features
"What is the difference between venv, pyvenv, pyenv, virtualenv, virtualenvwrapper, pipenv, etc?",1416,python virtualenv virtualenvwrapper pyenv python-venv
What is the Python 3 equivalent of “python -m SimpleHTTPServer”,1413,python python-3.x httpserver simplehttpserver
Create a dictionary with list comprehension,1400,python dictionary list-comprehension dictionary-comprehension
String formatting: % vs. .format vs. f-string literal,1392,python performance logging string-formatting f-string
How can I flush the output of the print function?,1387,python python-3.x printing flush
Selecting multiple columns in a Pandas dataframe,1385,python pandas dataframe select
UnicodeEncodeError: 'ascii' codec can't encode character u'\xa0' in position 20: ordinal not in range(128),1385,python unicode beautifulsoup python-2.x python-unicode
How can I use threading in Python?,1374,python multithreading concurrency python-multithreading
What are the differences between type() and isinstance()?,1374,python oop inheritance types
How to import a module given the full path?,1364,python configuration python-import python-module
How to prettyprint a JSON file?,1357,python json formatting pretty-print
Save plot to image file instead of displaying it using Matplotlib,1351,python matplotlib plot
How do I check what version of Python is running my script?,1324,python version
Referring to the null object in Python,1310,python null
How do I write JSON data to a file?,1309,python json
Use different Python version with virtualenv,1294,python virtualenv virtualenvwrapper
How do I get the row count of a Pandas DataFrame?,1289,python pandas dataframe
How do I get time of a Python program's execution?,1286,python time execution-time
How can I install packages using pip according to the requirements.txt file from a local directory?,1282,python virtualenv pip
How to find if directory exists in Python,1268,python directory
How do I trim whitespace from a string?,1257,python string trim
Is there a way to create multiline comments in Python?,1248,python comments documentation
How to get the filename without the extension from a path in Python?,1240,python string path
How can I check for NaN values?,1240,python math
What is setup.py?,1236,python python-3.x setup.py pypi python-packaging
Why does comparing strings using either '==' or 'is' sometimes produce a different result?,1222,python string comparison identity equality
How do I connect to a MySQL Database in Python?,1215,python mysql
Can someone explain __all__ in Python?,1207,python syntax namespaces
"In Python, how do I determine if an object is iterable?",1206,python iterable
if/else in a list comprehension,1205,python list-comprehension
How can I do a line break (line continuation)?,1202,python syntax line-breaks long-lines
What is the purpose of the word 'self'?,1201,python class oop self
How to terminate a script?,1198,python termination
How to put the legend out of the plot,1193,python matplotlib legend
Creating a singleton in Python,1185,python singleton decorator base-class metaclass
Correct way to write line to file?,1184,python file-io
Does Django scale? [closed],1178,python django web-applications scalability
"If Python is interpreted, what are .pyc files?",1177,python compiled interpreted-language pyc
Removing duplicates in lists,1174,python algorithm list duplicates intersection
Get list from pandas DataFrame column headers,1160,python pandas dataframe
Why do people write #!/usr/bin/env python on the first line of a Python script?,1157,python shell shebang
How can I reverse a list in Python?,1155,python list
How do I create a constant in Python?,1151,python constants
Best way to return multiple values from a function? [closed],1149,python coding-style return return-value
How can I represent an 'Enum' in Python?,1143,python python-3.x enums
Adding new column to existing DataFrame in Python pandas,1143,python pandas dataframe chained-assignment
How to get line count of a large file cheaply in Python?,1142,python text-files line-count
How do I trim whitespace?,1138,python string whitespace trim strip
How to get the ASCII value of a character,1132,python ascii
Is there a built-in function to print all the current properties and values of an object?,1129,python debugging introspection pretty-print python-datamodel
Best way to convert string to bytes in Python 3?,1129,python string character-encoding python-3.x
What is the use of “assert” in Python?,1128,python assert assertion
How to change the order of DataFrame columns?,1127,python pandas dataframe
How to read a text file into a string variable and strip newlines?,1124,python string
Create pandas Dataframe by appending one row at a time,1121,python pandas dataframe append
How can I sort a dictionary by key?,1117,python sorting dictionary
How do I find the location of my Python site-packages directory?,1109,python installation
How does the @property decorator work in Python?,1107,python properties decorator python-decorators python-internals
How do I check if a variable exists?,1103,python exception variables
How to move a file?,1092,python file file-handling
How to parse XML and count instances of a particular node attribute?,1089,python xml
"What is a mixin, and why are they useful?",1089,python oop multiple-inheritance mixins
“Large data” workflows using pandas,1089,python mongodb pandas hdf5 large-data
Display number with leading zeros,1087,python integer string-formatting
What is the difference between null=True and blank=True in Django?,1086,python django django-models
"Difference between del, remove, and pop on lists",1082,python list
Running shell command and capturing the output,1076,python shell subprocess
How can I get a list of locally installed Python modules?,1075,python module pip
What's the difference between lists and tuples?,1073,python list tuples
How to get file creation & modification date/times in Python?,1069,python file
How to copy a dictionary and only edit the copy,1061,python python-3.x dictionary reference
Count the number occurrences of a character in a string,1056,python string count
Relative imports in Python 3,1056,python python-3.x python-import
Putting a simple if-then-else statement on one line [duplicate],1055,python if-statement syntax ternary-operator
Change column type in pandas,1048,python pandas dataframe types casting
What is the difference between old style and new style classes in Python?,1047,python class oop types new-style-class
Getting key with maximum value in dictionary?,1046,python dictionary max
How do I get the full path of the current file's directory?,1044,python directory
Find all files in a directory with extension .txt in Python,1041,python file-io
Is there a simple way to delete a list element by value?,1033,python list
What is the standard Python docstring format? [closed],1027,python coding-style documentation docstring
How does Python's super() work with multiple inheritance?,1027,python multiple-inheritance
What IDE to use for Python? [closed],1026,python ide editor
How to iterate through two lists in parallel?,1018,python list for-loop iterator
How do I install a Python package with a .whl file?,1014,python pip python-wheel downloadfile jpype
pg_config executable not found,1010,python pip psycopg2
What does the 'b' character do in front of a string literal?,1008,python string unicode binary
Fastest way to check if a value exists in a list,1005,python performance list
Should I use 'has_key()' or 'in' on Python dicts?,1005,python dictionary
How to make a class JSON serializable,1002,python json serialization
Checking whether a variable is an integer or not [duplicate],1002,python integer
What are “named tuples” in Python?,996,python tuples namedtuple
How to drop rows of Pandas DataFrame whose value in a certain column is NaN,992,python pandas dataframe nan
Relative imports for the billionth time,982,python python-2.7 import python-2.x relative-path
"Should I put #! (shebang) in Python scripts, and what form should it take?",981,python shell python-3.x shebang
"Extract file name from path, no matter what the os/path format",980,python
How to get the home directory in Python?,980,python cross-platform home-directory
How to return dictionary keys as a list in Python?,973,python python-3.x list dictionary python-2.x
Get unique values from a list in python [duplicate],969,python list
Get difference between two lists,960,python performance list set set-difference
How to import other Python files?,959,python python-import python-module python-packaging
Why are Python lambdas useful? [closed],950,python function lambda closures
How to download a file over HTTP?,948,python http urllib
How to sort a list of objects based on an attribute of the objects?,947,python list sorting oop count
Why use pip over easy_install? [closed],947,python pip setuptools easy-install pypi
List comprehension vs. lambda + filter,946,python list functional-programming filter lambda
Remove all whitespace in a string,942,python trim removing-whitespace
How do I remove/delete a folder that is not empty?,942,python file
How do you test that a Python function throws an exception?,938,python unit-testing exception exception-handling
Peak detection in a 2D array,938,python image-processing
Get the data received in a Flask request,935,python flask werkzeug
How to remove items from a list while iterating?,933,python iteration
Converting unix timestamp string to readable date,932,python datetime unix-timestamp strftime
How to convert list to string [duplicate],931,python string list
How to emulate a do-while loop?,928,python while-loop do-while
How to overcome “datetime.datetime not JSON serializable”?,927,python json
How to catch and print the full exception traceback without halting/exiting the program?,927,python exception try-catch traceback
Converting from a string to boolean in Python?,919,python string boolean
Convert a String representation of a Dictionary to a dictionary?,919,python string dictionary
How to print an exception in Python?,918,python exception error-handling
Use a list of values to select rows from a Pandas dataframe,914,python pandas dataframe
Python's equivalent of && (logical-and) in an if-statement,913,python if-statement keyword logical-operators and-operator
How can I check file size in Python?,912,python file
How do I unload (reload) a Python module?,910,python module reload python-import
How to print number with commas as thousands separators?,908,python number-formatting
Maximum and Minimum values for ints,908,python integer
Behaviour of increment and decrement operators in Python,901,python operators increment decrement
How to remove the first Item from a list?,894,python arrays list
How to subtract a day from a date?,893,python datetime date
Usage of __slots__?,892,python oop python-internals slots
mkdir -p functionality in Python [duplicate],889,python path directory-structure mkdir
Multiprocessing vs Threading Python [duplicate],885,python multithreading multiprocessing
Python integer incrementing with ++ [duplicate],883,python syntax increment
pip install mysql-python fails with EnvironmentError: mysql_config not found,883,python pip mysql-python
How to make IPython notebook matplotlib plot inline,883,python matplotlib jupyter-notebook ipython data-visualization
What __init__ and self do in Python?,879,python oop self
How to deal with SettingWithCopyWarning in Pandas,875,python pandas dataframe chained-assignment
How to get a function name as a string?,874,python string function
Why does Python code run faster in a function?,867,python performance profiling benchmarking cpython
error: Unable to find vcvarsall.bat,863,python windows pip setup.py failed-installation
What is the naming convention in Python for variable and function names?,861,python variables function naming-conventions
How to retrieve a module's path?,861,python module inotify
How to use a decimal range() step value?,857,python floating-point range
Convert hex string to int in Python,856,python string hex
What is the difference between pip and conda?,856,python pip ipython package-managers conda
Convert list of dictionaries to a pandas DataFrame,854,python dictionary pandas dataframe
How to check if type of a variable is string?,853,python string variables types
python setup.py uninstall,853,python setup.py pypi
"What are the differences between the urllib, urllib2, urllib3 and requests module?",853,python python-requests urllib2 urllib python-2.x
How to get an absolute file path in Python,852,python path relative-path absolute-path
Pretty-print an entire Pandas Series / DataFrame,851,python pandas dataframe
How can I make a Python script standalone executable to run without ANY dependency? [duplicate],850,python executable
How to properly ignore exceptions,845,python exception try-except
How to use glob() to find files recursively?,843,python path filesystems glob fnmatch
How do you remove duplicates from a list whilst preserving order?,843,python list duplicates unique
Find which version of package is installed with pip,843,python pip
Python `if x is not None` or `if not x is None`? [closed],842,python coding-style nonetype boolean-expression pep8
Shuffling a list of objects,834,python list random shuffle
Is there any way to kill a Thread?,834,python multithreading kill terminate
Traverse a list in reverse order in Python,831,python loops reverse
Writing a pandas DataFrame to CSV file,822,python csv pandas dataframe
List comprehension vs map,821,python list-comprehension map-function
How to create a GUID/UUID in Python,819,python uuid guid uniqueidentifier
Using Python 3 in virtualenv,817,python python-3.x virtualenv
Is there a list of Pytz Timezones?,815,python django pytz
Why dict.get(key) instead of dict[key]?,813,python dictionary
"What is a clean, Pythonic way to have multiple constructors in Python?",808,python constructor
How do I determine the size of an object in Python?,808,python object memory memory-management sizeof
What is __pycache__?,808,python python-3.x caching
What is the best project structure for a Python application? [closed],806,python directory-structure organization project-structure
About catching ANY exception,804,python exception-handling
How to check version of python modules?,801,python
Running unittest with typical test directory structure,801,python unit-testing
How to set environment variables in Python?,800,python environment-variables
pip install from git repo branch,798,python git pip
How to define a two-dimensional array?,795,python matrix syntax-error
What is the purpose and use of **kwargs? [duplicate],795,python keyword-argument
How to import the class within the same directory or sub directory?,794,python python-import
Reverse / invert a dictionary mapping,793,python dictionary mapping reverse
How to POST JSON data with Python Requests?,792,python json python-requests cherrypy
How do I detect whether a Python variable is a function?,792,python
What is the easiest way to remove all packages installed by pip?,790,python pip
"What is __future__ in Python used for and how/when to use it, and how it works",790,python python-2.x
Remove empty strings from a list of strings,789,python string list
not None test in Python [duplicate],788,python nonetype
How to concatenate items in a list to a single string?,783,python string list concatenation
Writing a list to a file with Python,782,python file list file-io newline
How to change a string into uppercase,781,python string uppercase
Importing modules from parent folder,778,python module path directory python-import
Import a module from a relative path,778,python relative-path python-import
How do I expand the output display to see more columns of a Pandas DataFrame?,775,python pandas printing column-width
How can I use Python to get the system hostname?,774,python hostname
How do I convert a datetime to date?,774,python datetime
How to fix “Attempted relative import in non-package” even with __init__.py,773,python package python-import importerror init
Parsing boolean values with argparse,772,python boolean argparse command-line-arguments
How do you get the logical xor of two variables in Python?,770,python logical-operators
How do I do a not equal in Django queryset filtering?,767,python django django-models django-queryset
Equivalent of shell 'cd' command to change the working directory?,765,python cd
How can I open multiple files using “with open” in Python?,764,python file-io
What is the difference between range and xrange functions in Python 2.X?,763,python loops range python-2.x xrange
Get key by value in dictionary,759,python dictionary
Using @property versus getters and setters,759,python properties getter-setter
List of lists changes reflected across sublists unexpectedly,759,python list nested-lists mutable
How to sort a list/tuple of lists/tuples by the element at a given index?,756,python list sorting tuples
Print string to text file,753,python string text file-io
What does functools.wraps do?,752,python decorator functools
Styling multi-line conditions in 'if' statements? [closed],752,python coding-style if-statement
